{
  "inputIndex": 0,
  "documentId": "accepted-fpr12",
  "fileName": "accepted_fpr12.xml",
  "processingStatus": "SUCCEEDED",
  "conformanceStatus": "ACCEPTED",
  "previewConformanceStatus": "NOT_EVALUATED",
  "validationScope": "OFFLINE_PREFLIGHT",
  "externalStateStatus": "NOT_EVALUATED_EXTERNAL_STATE",
  "rulesetEffectiveAt": "2026-05-15",
  "sourceFormat": "XML",
  "validationFamily": "ITALY_FATTURAPA",
  "syntax": "FATTURAPA_XML",
  "profile": "FPR12",
  "scenario": "FatturaPA FPR12 private-sector invoice",
  "versions": {
    "validationScope": "OFFLINE_PREFLIGHT",
    "schemaSource": "OPEN_SOURCE_DERIVED",
    "officialArtifactsBundled": false,
    "ordinarySchema": {
      "formats": [
        "FPA12",
        "FPR12"
      ],
      "version": "1.2.3",
      "sha256": "10709324b24a5b5ba284bbf595392286cc94446d8b69defb2afd3a4f24f8213a",
      "baselineProject": "phax/ph-fatturapa",
      "baselineVersion": "ph-fatturapa-3.1.0",
      "baselineCommit": "c5fc3a97208bf22e50949b09dd9bd396cb18cc9f",
      "baselineSha256": "f40dda07ffc5790b02bda5fdad39705226c0a2b5bc6d42a60abd65e8e381ea5d",
      "license": "Apache-2.0"
    },
    "simplifiedSchema": {
      "format": "FSM10",
      "version": "1.0.2",
      "sha256": "698d4960a5e6121764e06157aef2593be5ea06fd4ab0938d52185643fcba4c29",
      "baselineProject": "invopop/gobl.fatturapa",
      "baselineVersion": "v0.69.0",
      "baselineCommit": "23b1ae16f7e5a243fa11f77e937912d0814db9e9",
      "baselineSha256": "0ced96c0e61c66eb88bb93f6eed55acabd18d96004a61d5fbf3b2e01ef1fc40f",
      "license": "Apache-2.0"
    },
    "xmlDsigSchemaSha256": "35cf8197da812c85e40d57891b35c94187569ed474a2dac813ce5090dafcd35c",
    "b2gProfile": {
      "schema": "VFPA12 1.2.3 derived compatibility schema",
      "formatSpecification": "FatturaPA 1.4",
      "sdiSpecification": "SdI 1.8.4",
      "controlReference": "Elenco controlli 2.0"
    },
    "b2bProfile": {
      "schemas": "VFPR12 1.2.3 and VFSM10 1.0.2 derived compatibility schemas",
      "technicalReference": "AdE Allegato A 1.9.1",
      "effectiveAt": "2026-05-15"
    },
    "deterministicChecksRevision": "2026-07-29",
    "activeRuleset": {
      "name": "FatturaPA offline profiles current from 2026-05-15",
      "effectiveAt": "2026-05-15"
    },
    "artifactManifestSha256": "0ef44ac189d98b098a988fc9fa7bfc401f0463e7d7458bd9ba63d7c9f8572f3f"
  },
  "counts": {
    "fatal": 0,
    "error": 0,
    "warning": 0,
    "information": 0
  },
  "findings": [],
  "findingsTruncated": false,
  "previewCounts": {
    "fatal": 0,
    "error": 0,
    "warning": 0,
    "information": 0
  },
  "previewFindings": [],
  "previewFindingsTruncated": false,
  "sha256": "a08f1d2bc65d5658860ccf15c5308f89617c87b2e3a5671a550d6288f100b7a7",
  "embeddedXmlSha256": null,
  "container": null,
  "checkedAt": "2026-07-29T11:23:36.056764Z",
  "reports": {},
  "error": null
}
